<!ELEMENT employees (employee+)>
<!ELEMENT employee (name, position, department, salary, contact)>
<!ATTLIST employee id ID #REQUIRED>
<!ELEMENT name (#PCDATA)>
<!ELEMENT position (#PCDATA)>
<!ELEMENT department (#PCDATA)>
<!ELEMENT salary (#PCDATA)>
<!ELEMENT contact (email, phone)>
<!ELEMENT email (#PCDATA)>
<!ELEMENT phone (#PCDATA)>
